small business owner offer good service online platform may part sharing,positive,0.0,0.612,0.388,0.6908
attempt make gstr filing easy gstfornewindia gstr gstsimplified pls share help others,positive,0.0,0.468,0.532,0.7964
clarity gstsimplified accounting startup innovation digitalindia gst,positive,0.0,0.485,0.515,0.6486
finally surat mein khushi ki laher gst textile surat business gstsimplified congratulation garment jobwork augustwish,positive,0.0,0.782,0.218,0.5994
gstsimplified gst brought profit essential industry owner like hotilers collect gst amp reduced pric ndtv,positive,0.0,0.707,0.293,0.6597
attened gst_conclave conference amazing gstsimplified gstfaqs gstfaqs gst newtrack newsalert,positive,0.0,0.703,0.297,0.5859
gstsimplified simplified even working properly active pan linked aadhar accepted gstportal,positive,0.0,0.652,0.348,0.5859
gst gstsimplified awesome registered online gst number le day gst received,positive,0.0,0.625,0.375,0.6597
solution gstsimplified gstfornewindia startupindia startupkarnataka saas accountant digitalindia solution,positive,0.0,0.603,0.397,0.5574
gstsimplified calculate gst good value plus delivery charge rate gst good gst delivery,positive,0.0,0.549,0.451,0.802
hyundai motor india limited eye upon gst better growth gstsimplified risingrajasthan gsthelpdesk gst,positive,0.109,0.575,0.316,0.5574
let u help decode gst register free webinar tomorrow pm ist gstfaqs gstsimplified,positive,0.0,0.625,0.375,0.7184
gstsimplified impact positive node result visible hope much come,positive,0.0,0.519,0.481,0.7579
form bihar acceptable gstsimplified promised entry barrier state,positive,0.133,0.442,0.425,0.5106
thank much amp field office fully committed serve taxpayer implementation gst gstsimplified,positive,0.0,0.671,0.329,0.5984
gstfornewindia gstrollout gstsimplified please help reconsider,positive,0.0,0.444,0.556,0.6124
free sample qualify supply good know arun gupta expert dia gstsimplified gstwithdia,positive,0.0,0.617,0.383,0.7351
govt asks dm act trade giving gst benefit consumer gstfornewindia gstsimplified mygstmitra,positive,0.0,0.649,0.351,0.6597
business confidence jul sep decline gst teething issue say report mygstmitra gstfornewindia gstsimplified,positive,0.0,0.784,0.216,0.5106
fashion lifestyle brand want share gst gain department chain gstfornewindia gstfaqs gstsimplified,positive,0.0,0.566,0.434,0.7096
gstsimplified word work complicated price rice india going suffer,negative,0.304,0.696,0.0,-0.5423
true illustration superb gstsimplified lol,positive,0.0,0.171,0.829,0.8658
gst real impact known commonman entertains family weekend gstforcommonman gstfornewindia gstsimplified,positive,0.0,0.746,0.254,0.5267
relaxation gst return filing gstsimplified gstboostforbiz gstforcommonman,positive,0.0,0.638,0.362,0.5267
